Session Name,Start Time,End Time,Description,SpeakersNavigating the Tech Scene with a Disability,12:40 PM,1:40 PM,"Individuals with disabilities often feel they do not ëfit intoí the tech scene. They have questions about if, when, and how they should disclose information about their disability in the context of education and employment. Panelists will describe their experiences disclosing disability, offer advice to others who are navigating these conversations and share tips on disability advocacy.","[{'name': 'Dr. Brianna Blaser', 'title': 'Project Manager', 'company': 'University of Washington'}, {'name': 'Ms. Meenakshi Das', 'title': 'Student', 'company': 'Auburn University'}, {'name': 'Lisa Maberry', 'title': 'Program Manager', 'company': 'Microsoft'}, {'name': 'Paulette Penzvalto', 'title': 'Program Manager, Google Cloud TI', 'company': 'Google'}, {'name': 'Ms. Kayla Williams', 'title': 'IT Analyst', 'company': 'Eli Lilly and Company'}]"
Promoting Personal Wellbeing with Agile Methods for Graduate Students and Professors,12:40 PM,1:10 PM,"Join us for practical life management techniques which promote better mental health by combining principles from cognitive psychology with agile methodologies. We will discuss setting priorities, knowing when to say ""no"", motivation, managing stress, and finding balance. You will leave with easy-to-implement strategies for helping you achieve these goals.",
Brain-Inspired Computing for the Edge,12:40 PM,1:40 PM,"With the rise of IoT devices, it is clear that machine learning will need to be pushed to the edge in custom hardware. Neuromorphic computing (NC) is one path forward, but there are many open questions about how it will be implemented and deployed. In this panel, experts in NC from academia, industry, and government will debate the future of NC and brain-inspired hardware for the edge.","[{'name': 'Dr. Catherine Schuman', 'title': 'Research Scientist', 'company': 'Oak Ridge National Lab'}, {'name': 'Dr. Dhireesha Kudithipudi', 'title': 'Professor, Robert F Mcdermott Endowed Chair in Engineering', 'company': 'University of Texas - San Antonio'}, {'name': 'Dr. Duygu Kuzum', 'title': 'Associate Professor', 'company': 'University of California, San Diego (UCSD)'}, {'name': 'Dr. Mondira Pant', 'title': 'Academic Research Director and Principal Engineer', 'company': 'Intel'}, {'name': 'Dr. Hai Li', 'title': 'Clare Boothe Luce Professor and Associate Chair of ECE Dept', 'company': 'Duke University'}]"
GHC Scholars Networking,12:40 PM,1:10 PM,Invite Only,
"The Magic of Empowering Your ""Gen Z"" Daughter with a $100 Gift to Make a Difference",1:10 PM,1:40 PM,"Given the increasing disparities, racial profiling, and protests today, many parents want to raise kids who care about fairness and equity in communities. What can we do to ensure our Gen Z (and Gen Alpha) make a positive impact? Come listen to this mother-daughter duo's successful philanthropic journey, from a $100 gift to over $100,000 in giving, and learn proven techniques to guide your youth.","[{'name': 'Sonali Ranaweera', 'title': 'Student and Founder', 'company': 'University of California, Berkeley'}, {'name': 'Dr. Jeewika Ranaweera', 'title': 'Principal Hardware Engineer', 'company': 'Oracle'}]"
Chi-chat: A Metric-Driven User Cohorting Framework for Best Channel Recommendation,1:10 PM,1:40 PM,"When customers file tax returns using products like TurboTax, they often seek help from tax experts. We developed a novel metric-driven ML method that recommends the best channel: chat, callback or scheduling. With training data that now includes COVID-19 stimulus check inquiries, we can enhance the user experience of customers who are financially impacted and improve our operational efficiency.","[{'name': 'Dr. Wen Yao', 'title': 'Senior Data Scientist', 'company': 'Intuit'}, {'name': 'Dr. Zhewen(Joanne) Fan', 'title': 'Senior Data Science Manager', 'company': 'Intuit'}]"
Be Brave: Lessons from a Total Technology & Culture Transformation,1:10 PM,1:40 PM,"Meredith Johnson helped lead process and culture transformations that evolved Blackbaud's tech strategy from an on-prem leader at risk of stagnation to an agile development model. Recently, she led teams to roll out features needed by social good organizations to operate during COVID-19 in just days. Learn how to inspire teams to continually innovate and why culture is harder than product updates.","[{'name': 'Meredith Johnson', 'title': 'Vice President, Product Management', 'company': 'Blackbaud'}]"
BRAID Welcome Reception,1:10 PM,1:40 PM,"The BRAID initiative is an NSF-funded research project that supports computer science departments with efforts to increase the percentage of women and URM students in their undergraduate computing programs. This reception will provide a networking opportunity for students and faculty from the 15 BRAID institutions and the project’s corporate funders (Intel, Microsoft, and Qualcomm). Invite Only.",
Being an Ally in Academia,1:10 PM,1:40 PM,"Are you a professor, graduate or undergraduate student or otherwise working in academia? In this session, we’ll talk about being an ally and helping to combat racism and increase diversity and inclusion in academic environments including the classroom, research meetings and conferences. We’ll share our experiences and things we have learned while focusing on practical tips from how to respond constructively when someone makes a comment that doesn’t feel right to things you can do at your institution.",
Keynote,1:45 PM,2:15 PM,,
